CRSE_ID,CRSE_SUBJECT,CRSE_NBR,CRSE_TITLE,CRSE_DESCRIPTION
8876,CS,463,"ASSESSMENT, DIAGNOSIS, DEVELOPMENTAL/REMEDIAL MATERIALS & RESOURCES: EMERGENT & DEVELOPING READING","Assessment, diagnosis and instructional planning for early and emergent learners. Building on a knowledge base of emergent reading processes and literacy practices, teachers will explore the ways in which young learners construct meaning and use language purposefully in their unique social worlds, even before beginning school. Participants in this course will learn to use performance based assessments as well as more formal standardized measures of achievement to support emerging and struggling readers with appropriate materials and theoretically sound instructional practices."
8877,CS,464,"ASSESSMENT, DIAGNOSIS, DEVELOPMENTAL/REMEDIAL MATERIALS & RESOURCES:MIDDLE SCHOOL/ADOLESCENT READING","Assessment, diagnosis and instructional planning for middle school students. Building on a knowledge base of reading processes and literacy practices, teachers will explore the ways in which students construct meaning and use language purposefully in their unique social worlds. Participants in this course will learn to use performance based assessments as well as more formal standardized measures of achievement to support middle school and adolescent readers with appropriate materials and theoretically sound instructional practices."
9813,CS,465,TEACHING READING IN THE CONTENT AREAS,"This course focuses on teaching reading in various subject (content) areas and emphasizes non-fiction reading process, strategies, and theories for grades K-9. The course will examine what it means to be literate in the elementary content areas (e.g. science, math, social studies, arts). Emphasis will be placed on learning effective literacy strategies for different subject areas.  There will also be a focus on how one uses reading and writing to think, act, speak, question, and apply the tools of each content/subject area in ways that are unique to that discipline.  Additionally, as teachers it is important to remember that students will bring various literacies from their homes and communities.  An important emphasis will be on creating learning environments that honor student diversity, and learning about multiple ways of knowing, acting, and communicating."
7519,IS,467,FUNDAMENTALS OF DATA SCIENCE,"An introduction to the Knowledge Discovery Technologies covering all stages of a data mining process: domain understanding, data collection and selection, data cleaning and transformation, dimensionality reduction, pattern discovery, evaluation, and knowledge extraction.  The course provides a comprehensive overview of data mining techniques used to realize these stages, including traditional statistical analysis and machine learning techniques.  Students will analyze large datasets and develop modeling solutions to support decision making in various domains such as healthcare, finance, security, marketing, customer relationship management (CRM), and multimedia.  PREREQUISITE(S): IT 403 or CSC 423"
6423,SE,468,SOFTWARE MEASUREMENT/PROJECT ESTIMATION,"Software metrics. Productivity, effort and defect models. Software cost estimation.  PREREQUISITE(S): IT 403 and (SE430 or SE450)"
7584,CS,470,TEACHERS AS LEADERS,"Assists teachers in becoming leaders for positive change in schools and districts. Provides overview of major theoretical models in research on teaching and teacher leadership, historical perspectives on the teaching profession, and overview of select best practice in teacher collaboration, mentoring and coaching. Specific topics addressed may include: developing leadership among existing teaching staff; fostering professional collaboration; improving instruction school-wide; organizing colleagues, administrators, parents and students to improve achievement; fostering sustainability in teaching/fighting teacher attrition; teaching standards; team teaching; and curriculum mapping."
6625,HCI,470,DIGITAL DESIGN,"Focus on the visual aspects of interfaces for information and communication technologies (ICTs). Evaluate, critique and create ICT interfaces using design principles. Learn to choose color, type, layout and imagery to create aesthetic and usable ICT interfaces. Introduction to information visualization. Applying course concepts, students create and develop their own web-based portfolio.  PREREQUISITE(S): HCI 402 and HCI 406"
7585,CS,471,DIVERSITY IN THE CLASSROOM,"Examines issues related to diversity that result when students from diverse socioeconomic, cultural, linguistic, and academic backgrounds are in the same classroom. Explores the impact of inclusion, ESL, bilingual, and bicultural programs on instruction. Emphasis on developing strategies to meet individual student needs within the regular classroom."
7586,CS,472,"ETHICS, CURRICULUM AND SOCIAL CHANGE","Explores some major issues impacting curriculum, including cultural and socioeconomic factors, legal issues, conflicting values, pressures for assessment, and the push to include technology. Examines the historical development and current state of education in the U.S. as compared to education in other cultures. Emphasis on ways that educators can work as change agents within the competing demands of these forces."
7587,CS,473,ASSESSMENT,"Explores current theory and practice regarding alternate forms of assessment, including formal, standardized, and informal tests and inventories; selection, evaluation, and interpretation of tests used in educational settings; portfolio assessment, video performances, and presentations; preparation and use of teacher-made tests; evaluating outcomes; and utilizing data to improve instruction.  The critical examination of multiple perspectives of assessment theories, policies and practices center around the emphasis on developing strategies to evaluate student progress."
12340,SE,475,MANAGING GLOBALLY DISTRIBUTED SOFTWARE DEVELOPMENT,"Managing Globally Distributed Software Development (GDSD) for IT projects.  Issues associated with time zone differences, infrastructure support, geographical dispersion, and lack of centralized communication.  The course will focus on the management, implementation and deployment of software within the context of outsourced, distributed development, and insourced projects.  Additional topics include strategic management issues such as justification, vetting, consulting services and partnerships.  Course will include several hands-on distributed development projects. PREREQUISITE(S):  CSC 403"
8304,IS,477,FUNDAMENTALS OF IT PROJECT MANAGEMENT,"This course concentrates on monitoring, managing and controlling assets and resources on a single IT project.  Topics covered are risk management; procurement and contract management; time and cost estimating; controlling and tracking techniques; quality assurance; testing and audit.  Students will use common project management software for resource allocation and balancing. PREREQUISITE(S): None"
6425,SE,477,SOFTWARE AND SYSTEMS PROJECT MANAGEMENT,"Project Management is presented from a practitioner's view.  The four basic building blocks of software project management: people, process, tools, and measurements are covered.  Special emphasis is placed on professional standards such as the Project Management Book of Knowledge and IEEE Software Engineering Standards.   Specific topics include Managing People, Selecting Project Tools, Leadership & Motivation, Software Development Processes, Estimation, Risk Analysis, Scheduling and Tracking, Leveraging Measurements, and Project Completion.  Consideration is given to rapid development and project cultural issues. PREREQUISITE(S): Knowledge of the Software development life cycle model, for example through courses such as SE430, ECT455, IS425, MIS555 or through appropriate work experience."
6426,SE,480,SOFTWARE ARCHITECTURE I,"The Software Architecture process is concerned with describing, evaluating, and designing systems at the architectural level. This course will discuss the role of architecture and the architect in the software development cycle. It will introduce architectural patterns and tactics, architecture assessment techniques, architecture driven design, and techniques for documenting architectures. The course will involve design, development, and assessment activities.  PREREQUISITE(S): SE 450"
6444,ECT,480,INTRANETS AND PORTALS,"Intranet development methodology. Data warehousing concept and On-Line analytic processing (OLAP) for information management.  Enterprise information portals (EIP).  Transforming information into knowledge.  Major applications involve: decision support, customer applications and content personalization for intranet.  Students will conduct case studies and projects.  PREREQUISITE(S):  ECT 424"
1978,CS,481,THE STUDY OF TEACHERS AND TEACHING,"A selective survey and analysis of research on teachers and teaching. Particular emphasis will be placed on the assumptions which are built into various forms of research and the effect these assumptions have on how results should be interpreted and used in supervision and curriculum development.  Each student will be expected to become familiar with alternative ways of studying teachers and the teaching process in his/her area of expertise.  While many school settings will be utilized because of the many studies done in this area, research in non-school settings will be given a good deal of emphasis."
6445,ECT,481,INTERNET SUPPLY CHAIN MANAGEMENT,"This course examines system architectures, technologies, approaches, and infrastructure requirements in the context of supply chain systems. The focus is on the design, development and implementation of systems that facilitate the collaboration of an enterprise with its buyers and suppliers. Topics include development of messaging-based collaboration framework with web services. Students will design and implement a collaborative extranet system component in team projects. PREREQUISITE(S): CSC 401 or IT 411"
7741,SE,482,REQUIREMENTS ENGINEERING,"Requirements Engineering (RE) plays a critical role in the software development process.  This course will introduce related vocabulary, concepts, and techniques, and will examine the role of RE in software and systems engineering.  The course will cover topics related to eliciting, validating, negotiating, analyzing, specifying, and managing requirements.  Popular RE tools will also be introduced.   Prerequisite: SE430 or SE450."
1979,CS,482,THE HISTORY OF CURRICULUM PRACTICE,A survey of trends and movements in curriculum practice. Particular emphasis will be placed on the recurrent nature of curriculum practices and the reasons for this. The class will consider underlying models of curriculum practice in their historical settings as possible methods for meeting contemporary social needs as well as the assets and liabilities of these models.
1979,CS,482,THE HISTORY OF CURRICULUM PRACTICE,A survey of trends and movements in curriculum practice. Particular emphasis will be placed on the recurrent nature of curriculum practices and the reasons for this. The class will consider underlying models of curriculum practice in their historical settings as possible methods for meeting contemporary social needs as well as the assets and liabilities of these models.
6384,IS,482,LEGAL RESPONSIBILITIES IN INFORMATION TECHNOLOGY,"This course examines the legal standards to which people and organizations are held under laws and regulations that concern computing and information technology. This course is a complement to CNS 477, which focuses on governance policies and business costs. Topics include government and laws, business regulations, healthcare regulations, education regulations, data breach reporting and notification, privacy laws, laws of search and seizure, freedom of speech and association, defamation, cyber crimes, contracts, and intellectual property.  PREREQUISITE(S): None"
6385,IS,483,INFORMATION SERVICES AND OPERATIONS,"This course focuses on the operational aspects of information systems in organizations by examining the concepts, tools and techniques available to IS professionals responsible for the delivery of IT services.  Topics include the organization of the IT services; the procurement of hardware, software and vendor services; operation of data centers, help desks and user training, the development and use of RFPs (Request for Proposals) and SLAs (Service Level Agreements),  the integration of services and operations with application development project needs, and the role of capital and operating budgets.  PREREQUISITE(S):  Completion of five or more SoC MS level courses is required."
1981,CS,484,MULTIMEDIA MATERIALS PRODUCTION,"This course will analyze the role of multimedia materials in instruction.  A variety of media will be explored (including software, internet, audio, video, and film).  Students will be expected to manipulate a variety of images and produce sample materials for critique and analysis.  The primary focus will be on enhancing learning in elementary and secondary schools."
6628,ECT,484,WEB DATA MINING (FORMERLY ECT 584),"An in-depth study of the knowledge discovery process and its applications in Web mining, Web analytics and business intelligence.  The course provides coverage of various aspects of data collection and preprocessing, as well as basic data mining techniques for segmentation, classification, predictive modeling, association analysis, and sequential pattern discovery.  The primary focus of the course is the application of these techniques to Web analytics, user behavior modeling, e-metrics for business intelligence, Web personalization and recommender systems.  Also addressed are privacy and ethical issues related to Web data mining.  Students can choose from three types of final course projects: implementation projects, research papers, or data analysis projects.  Throughout the course, the students will learn and use a variety of data mining tools to analyze sample data sets as part of class assignments. PREREQUISITE(S): IT 403 AND (CSC 451 or CSC 453 or DSC 450)"
1982,CS,485,CURRICULUM/PROGRAM EVALUATION,"Evaluation is essential for curriculum/program development and implementation. Hence, understanding evaluation methods, technologies, and quality criteria is particularly relevant to educational leaders, curriculum/program designers, and technology specialists. In this course, students will critically examine a variety of current evaluation models, instruments, and resources. Students will also conduct a comprehensive analysis of a significant evaluation study relevant to their specific professional interest. Registration is restricted to students in Advanced Master's programs."
10529,IS,485,"REQUIREMENTS ELICITATION, ANALYSIS, AND SPECIFICATION","This course focuses on the concepts and skills needed to elicit, analyze, specify, and manage requirements for a software or systems level project. Students will learn to identify and work with stakeholders through conducting a variety of requirements gathering techniques including interviewing, surveying, ethnography, and Joint Application Design (JAD) sessions, to identify and analyze requirements conflicts and negotiate solutions,  to model requirements and specify them in unambiguous ways, and to manage requirements throughout the software lifecycle using change controls, traceability, and impact analysis techniques.  The requirements process will be examined in both traditional and agile environments. Current topics such as requirements for product lines or distributed development teams will also be explored as time permits.   A student may not take both SE 482 and IS 485 for credit toward a degree. PREREQUISITE(S): IS 422 or IS 430 or PM 430."
1984,CS,487,INTRODUCTION TO CURRICULUM DELIBERATION,"An introduction to systematic and collaborative deliberation on curriculum problems. A pattern for deliberation (including situation analysis, problem discrimination and formulation, development of alternative courses of action, and anticipation of consequences) will be developed and exemplified.  This pattern will be contrasted with other descriptions of curriculum planning.  Each student will complete a project which describes his/her systematic formulation of a curriculum problem and a plan of action for resolving it."
1985,CS,488,CURRICULUM DESIGN,"Provides a project-based opportunity to develop curriculum that promotes student understanding, student voice, and student involvement in school or community change. Encourages educators to think carefully about what does and should constitute the curriculum and why, who and what is served and who/what is marginalized by current curriculum arrangements, and how collaboration in curriculum design can assist in organizing classrooms, schools, and communities."
1986,CS,489,"CREATIVITY AND CRITICAL THINKING - VYGOTSKY, BAKHTIN, MAKIGUCHI, IKEDA","Introduces students to the educational philosophies of Russian thinkers Lev Vygotsky (1896 - 1934) and Mikhail Bakhtin (1895 - 1975) and Japanese thinkers Tsunesaburo Makiguchi (1871 - 1944) and Daisaku Ikeda (1928 - ). Students will locate confluences in these thinkers' philosophies and apply them to current curriculum or curriculum theorizing in their chosen discipline(s) (e.g., mathematics, social studies, language education, etc.), context(s) (e.g., policy, gender, socioeconomics, identity, etc.) and K-12/adult level(s). Topics covered include, among others, cultural-historical theory, socially constructed meaning making, zone of proximal development, dialogism, carnival, value and value-creating pedagogy, humanitarian competition, and human revolution."
6427,SE,491,SOFTWARE ENGINEERING STUDIO,Students will work in small teams to develop realistic software systems in a master-apprentice environment. The instructor will serve as a master/mentor/project leader. Students will apply knowledge and skills they have learned in previous course in solving real world problems.  PREREQUISITE(S): SE 450 or SE 456.
10318,CS,492,CREATING AND SUSTAINING PROFESSIONAL LEARNING COMMUNITIES,"This course will provide the framework for the creation, development and sustainability of a professional learning community. Professional learning communities have at their core three guiding principles: 1) a focus on learning, 2) the creation of a collaborative culture and 3) a results-orientation. Within the professional learning community, members are committed to working collaboratively in an ongoing process of collective inquiry and action research in order to achieve better results for the students and community they serve.  Professional Learning Communities operate under the assumption that the key to improved learning for students is continuous, job-embedded learning for educators."
12651,CS,493,CURRICULUM DEVELOPMENT AND ASSESSMENT IN K-12 SCHOOLS,"This course prepares future school leaders with knowledge; understanding; and application of planning, assessment, and instructional leadership for roles in the K-12 school setting at the supervisory or administrative level. The emphasis of the course will be planning, implementation, and refinement of standards-based curriculum aligned with instruction, assessment, and instructional decisions as they affect the teaching and learning environment of the school with diverse cultural, ethnic, linguistic, and special needs populations."
14829,CS,494,CURRICULUM 2.0: CURRICULUM FOR LEARNING IN GLOBAL NETWORKS,"This course will explore curriculum theories and practices for the age of global networks, including themes such as the shift from industrial to post-industrial educational paradigms, online learning, and more. New communications technologies make it possible for teaching and learning to take place anywhere and anytime, in many cases under conditions radically different from those of formal schooling. This course considers the implications of curriculum under such conditions."
14830,CS,495,DESIGN THINKING IN EDUCATION,"Design Thinking is a problem solving methodology for collaborative innovation. This course introduces the methods of design thinking applied to curriculum design and education in general. Students will learn how to use design thinking for insight, ideation, and implementation of collaborative solutions to complex educational problems. In addition, students will understand design thinking within the context of the history of ideas and be able to critically analyze and evaluate implementations of design thinking in a variety of educational settings."
11963,IS,500,INFORMATION TECHNOLOGY LEADERSHIP,"Managing people ethically and effectively by applying a broad range of creative approaches to individual and team leadership within an Information Technology context.  Leadership methods studied include trait-based, skills-based, situational, contingency theory, path-goal theory, leader-member exchange theory, transformational, psychodynamic, and authentic leadership, as well as team leadership and the international, cultural, and ethical dimensions of leadership.  Students assess their leadership styles and design individualized development plans to strengthen existing skills and expand IT leadership capabilities by incorporating additional leadership dimensions.  PREREQUISITE(S): IS 430 OR PM 430 OR SE 477"
8291,IS,505,BUSINESS CONTINUITY/DISASTER RECOVERY THEORIES AND STRATEGIES,"This course focuses on the knowledge necessary for an organization to prepare for a variety of major disruptions (floods, earthquakes, terrorist attacks, etc.).  The goal is survival of the organization and its daily workflow despite major disruption.  Students learn to analyze and prioritize risks and determine criticality ratings that are used to determine survival strategies.  Students also learn how to organize employees to respond to a major disruption and how to document recovery plans.  Course content includes coverage of current industry trends, as well as planning for the survival of Information Technology functions within an organization."
10227,IS,506,BUSINESS CONTINUITY/DISASTER RECOVERY MANAGEMENT AND TACTICS,"The course prepares students to lead an organization's business continuity and disaster recovery plans.  Students learn the methodology needed to organize this function within an organization, evaluate an organization's business continuity and disaster recovery program according to established industry standards, and conduct a variety of quick-recovery drills.  Students also focus upon industry-related human resources issues, crisis communications, and policies and procedures for setting up a command center. Course content includes coverage of current industry trends, as well as managing the survival of Information Technology functions within an organization.  PREREQUISITE(S):  IS 505"
6387,IS,511,SOCIAL ISSUES OF COMPUTING,"This course aims to provide a broad survey of the individual, organizational, and cultural impacts of computers and to stimulate reflection upon the social and ethical issues provoked by current and projected uses of computers. Some topics include an in-depth look at computers as they relate to workplaces, communities, public policy, legal issues, education, privacy, and moral values. PREREQUISTE(S): NONE."
6502,HCI,511,ACCESSIBILITY AND DESIGN FOR DIVERSE USERS,"Methods and principles for designing interactive technologies for diverse users, including children, elderly, and people with disabilities and alternative skills.  Analysis of how current technologies address diverse user needs and considerations about how technologies might be improved to better meet diverse user needs.  Class projects include a web accessibility evaluation based on current w3 standards and an in-depth research project in which students ideate a new technology or evaluate an existing technology in which they work directly with people who have disabilities.  PREREQUISITE(S): HCI 445 (HCI 460 recommended)"
10493,SE,511,PRACTICES OF GLOBAL SOFTWARE DEVELOPMENT,"This course studies the challenges and solutions for developing software in a global environment.  Topics covered include strategic issues related to allocation of tasks; communication issues that arise due to distance, time zone differences, infrastructure support, geographical dispersion, and lack of information communication; coordination complexity; cultural issues, technical issues related to information and artifact sharing, and architectural design, and finally knowledge management issues.  Some sections of this course will include a hands-on global development project in conjunction with teams of students at other universities, while other sections will focus on a more in-depth theoretical discussion of these issues and concepts.  Prerequisite(s):  SE 450 or SE 430 or IS 430 or PM 430.A student may not take both IS 540 and SE 511 for credit toward a degree."
6388,IS,512,COLLABORATIVE TECHNOLOGIES FOR LEADING PROJECTS,"Study of the process of virtual teaming with emphasis on facilitation of different time project activities and facilitation of same time meetings.  Students will learn how small group psychology and group communication theories inform specific behaviors in the design and leadership of meetings.  Several meeting types including information briefing, focus group, document writing, decision making, requirements gathering, and teaching/training will be explored.  In addition, the course surveys current collaboration technologies and discusses how toselect among those technologies usability and fit to purpose of a meeting agenda.  DL students may be required to schedule same time sessions with the instructor and other DL students; see current quarter syllabus for more information on this point.  PREREQUISITE(S): None"
