CRSE_ID,CRSE_SUBJECT,CRSE_NBR,CRSE_TITLE,CRSE_DESCRIPTION
6492,HCI,400,INQUIRY METHODS AND USE ANALYSIS,"This course provides students with the skills necessary to acquire and organize user information for the purpose of developing task and systems analyses.   Topics covered include survey construction and administration, structured observation, interviewing, and participatory design.  Students learn to evaluate and organize user information toward making analysis and design decisions.  Human communication and presentation skills are developed.  PREREQUISITE(S): IT 403 and (HCI 440 or HCI 441)"
12474,IS,400,INTRODUCTION TO IS MANAGEMENT SEMINAR,This one-credit seminar examines the concepts of information and technology management and career options in this field. Students will assess their own interests and skill requirements for various careers. They will also analyze the impacts of IS trends and emerging technologies on their career choices. All new IS master's students are required to take this seminar as the first course. PREREQUISITE(S): None  (1 quarter hour)
6588,HCI,402,FOUNDATIONS OF DIGITAL DESIGN,"Shape, line on two-dimensional surfaces. Color. Composition rules as they apply to digitally created documents. Digital manipulation of two-dimensional images. Use of commercially available draw and paint tools to create two-dimensional designs. PREREQUISITE(S): None"
12471,IT,403,STATISTICS AND DATA ANALYSIS,"Introduction to univariate data analysis methods. Descriptive statistics and data visualization methods. Overview of sampling techniques for data collection, and introduction to statistical inference methods for decision making including simple linear regression, estimation procedures using confidence intervals and hypothesis testing. PREREQUISITE(S): None"
12477,HCI,406,WEB SITE DESIGN FOR HCI,"Web design introduced in a user-centered context. Application of visual design principles and common design patterns for web sites and mobile interfaces. Page markup using HTML and CSS addressing responsive web design, accessibility, and search engine optimization. PREREQUISITE(S): None"
12473,ECT,410,DEVELOPMENT OF WEB-BASED BUSINESS APPLICATIONS,"Development of web-based business solutions using client-side and server-side technologies. Major topics include analysis and design of web projects for a business, web application design patterns, server-side programming, and access to databases. PREREQUISITE(S): CSC 401 or IT 411"
12476,IT,411,SCRIPTING FOR INTERACTIVE SYSTEMS,"Introductory scripting for developing interactive web pages. Overview of HTML and CSS. Elementary programming concepts using JavaScript for learning control structures, functions, arrays, and object use. User interface development concepts include event  handling and use of JavaScript libraries such as jQuery. Review of web clients, servers and architecture. PREREQUISITE(S): None"
6379,IS,421,SYSTEMS ANALYSIS,"Course focus is on both traditional and object oriented systems analysis, with an emphasis upon developing competency in a wide range of modeling techniques.  Specific topics include: overview of the software development environment and project management; project selection, initiation, and planning; determining requirements; process modeling, including DFDs and use cases; logic modeling, including decision tables, sequence diagrams, and activity diagrams; introduction to Entity-Relationship Diagrams.  PREREQUISITE(S): None"
10370,HCI,421,DESIGNING FOR CONTENT MANAGEMENT SYSTEMS,"Design and development of Web sites using common database-driven content management systems (CMSs) and publishing tools such as those used to manage blogs, community portals, and other content-heavy websites.  Discussions of how familiarity with CMS tools assists the role of the user experience designer.  Visual design and theme customization using prior knowledge of CSS.  Taxonomy systems, installation of add-on modules, and user management using today's widely used systems.  PREREQUISITE(S): HCI 406"
6380,IS,422,"SYSTEM DESIGN, IMPLEMENTATION, AND MAINTENANCE","Course focus is on both traditional and object oriented systems design.  Specific topics include: database design, including logical and physical design; Entity-Relationship diagrams, class diagrams,  form and report design; interface and dialogue design; design specifications, including structure charts and prototypes; designing for LANs and distributed systems, as well as the Internet; system implementation, including parallel and phased implementation, testing, documentation, and user training; system maintenance, including types of maintenance, controlling and coordinating maintenance requests, and configuration management.  Course ends with a multi-week case study applying the principles from both this course and IS 421, Systems Analysis.  PREREQUISITE(S): IS 421 and CSC 451"
6495,HCI,422,MULTIMEDIA,"Multimedia interface design. Underlying technological issues including synchronization and coordination of multiple media, file formats for images, animations, sound and text. Hypertext. Information organization. Survey of multimedia authoring software. Topics in long distance multimedia (World Wide Web). Students will critique existing applications and create several multimedia applications.  PREREQUISITE(S): HCI 440 or consent of the instructor."
11143,ECT,424,ENTERPRISE INFRASTRUCTURE,"Introduction to modern infrastructure and the evolving technology environment.  Major topics include: computer networks, Internet infrastructure, Web 2.0, Enterprise 2.0, social media and networking, software as a service, content management systems, cloud computing,  and portal."
8304,IS,430,FUNDAMENTALS OF IT PROJECT MANAGEMENT,"This course concentrates on monitoring, managing and controlling assets and resources on a single IT project.  Topics covered are risk management; procurement and contract management; time and cost estimating; controlling and tracking techniques; quality assurance; testing and audit.  Students will use common project management software for resource allocation and balancing. PREREQUISITE(S): None"
6414,SE,430,OBJECT ORIENTED MODELING,"Object-oriented modeling techniques for analysis and design. Provides the tools and techniques needed to solve complex, real-world software engineering problems in an object-oriented manner, using the most effective elements of the Unified Process. The course covers the essential concepts and notation of the Unified Modeling Language (UML), the standard notation for object-oriented analysis and design. Team project. PREREQUISITE(S): CSC 403"
6496,HCI,430,PROTOTYPING AND IMPLEMENTATION,Overview of prototyping methods ranging from low-fidelity to interactive script-based prototypes.  Analysis of prototyping tools and their relative advantages.  Projects include prototype  development over multiple iterations using a variety of strategies.  PREREQUISITE(S): IT 411.  Students must have completed or be concurrently enrolled in HCI 440 or HCI 441 to register for this course.
12734,IS,431,DIGITAL PRODUCT MANAGEMENT,This course focuses on the central role of the Product Manager in creating and sustaining compelling products and services throughout the product lifecycle. Special emphasis is placed on the creation and management of intangible technology products and services throughout the entire product management lifecycle. Product managers act as the focal point for value creation within their organizations leading cross functional product activities from the conception of an idea to the ultimate product retirement. PREREQUISITE(S): None
6415,SE,431,MODEL-DRIVEN SOFTWARE DEVELOPMENT,"Advanced methods and techniques in software specification, modeling, and model-driven development.  Topics include approaches to software specification and modeling, formal specification languages, techniques for structural and behavioral modeling of software systems, and tools for analysis and transformation of software systems.  PREREQUISITE(S): SE 430 or SE 450"
9952,IT,432,WEB ARCHITECTURE,"Overview of Web application development for non-programmers.  Hands-on exposure to the Model, View, Controller (MVC) framework using a common web framework.  Topics include HTML/CSS, data modeling, authentication, AJAX and security issues.  Students create and modify dynamic web sites.  PREREQUISITE(S): IT 411"
6397,IS,433,INFORMATION SECURITY MANAGEMENT,"Managing information assets and the security function. Emphasis on managing security-related risk, as well as the process of developing, implementing, and maintaining organizational policies, standards, procedures, and guidelines as they relate to security. Role of the CISO. Identifying and evaluating information assets, threats, and vulnerabilities. Quantitative and qualitative risk analysis, risk mitigation, residual risk, and risk resolution, as they relate to information security. Incident response. Consideration of the role and implementation of security controls during the process of analysis, design, and development. The application of policy development principles to security risk management. Introduction to compliance, as well as the CISSP domains.  PREREQUISITE(S): None"
6416,SE,433,SOFTWARE TESTING AND QUALITY ASSURANCE,"This course is designed for the software engineering professional to gain a greater understanding of the key ingredients in creating and/or managing a successful testing program to meet project needs.  Topics covered include test lifecycle planning, test design & coverage analysis, complexity, levels of testing such as unit, integration, system, performance and stress testing.  Best practice strategies in software testing such as verification & validation, early lifecycle testing, risk based testing and automation will also be examined including exposure to test automation methods and tools. PREREQUISITE(S): CSC 403"
10036,IS,435,ORGANIZATIONAL MODELING,"The course explores contemporary approaches to analyzing and modeling organizational problems, processes, workflow, users and data.  The emphasis is on the initial stages of analysis where the root cause of problems are identified, formulated and modeled.  Students will acquire an array of modeling skills and be able to prescribe the proper modeling approach based on a variety of organizational and contextual factors.  Business process modeling, management and metrics will be covered.  Object-oriented and user-centered approaches will be introduced. PREREQUISITE(S):  IS 421 or SE 430"
6406,SE,435,DISTRIBUTED SYSTEMS I,"An introduction to distributed systems. Topics may include: architecture of distributed systems; networking; datagram-oriented and stream-oriented protocols; network programming (for example, the sockets API); remote procedure call and remote method invocation; processes and threads; code migration; software agents; naming of non-mobile and mobile entities; cryptography and security.  PREREQUISITE(S): CSC 403 and CSC 407"
11162,ECT,436,SOCIAL MARKETING AND SOCIAL NETWORKING APPLICATIONS,"Online social media and culture, online social marketing concepts, online social networking applications and their design/development.  Students develop dynamic web sites and applications on social networking platforms using server-side programming technology to meet strategic marketing goals.  PREREQUISITE(S): None"
6388,IS,440,COLLABORATIVE TECHNOLOGIES FOR LEADING PROJECTS,"Study of the process of virtual teaming with emphasis on facilitation of different time project activities and facilitation of same time meetings.  Students will learn how small group psychology and group communication theories inform specific behaviors in the design and leadership of meetings.  Several meeting types including information briefing, focus group, document writing, decision making, requirements gathering, and teaching/training will be explored.  In addition, the course surveys current collaboration technologies and discusses how toselect among those technologies usability and fit to purpose of a meeting agenda.  DL students may be required to schedule same time sessions with the instructor and other DL students; see current quarter syllabus for more information on this point.  PREREQUISITE(S): None"
6497,HCI,440,INTRODUCTION TO USER-CENTERED DESIGN,"The user-interface development process. Introduction to methods for practicing user-centered design including user and task analysis, user interface design principles and testing using low-fidelity prototypes. Students may not receive credit for this course and HCI 441.  PREREQUISITE(S): None"
13366,HCI,441,INTRODUCTION TO USER-CENTERED DEVELOPMENT,"Overview of the user-centered design (UCD) process with an additional emphasis on user interface development. Coverage of UCD process includes effective, low-cost methods for user research, interaction design and evaluation. User interface development involves application of front-end development languages (HTML and JavaScript) and frameworks (jQery). This course is offered to students with programming experience as an alternative to IT 411 and HCI 440. Students may not receive credit for this course and HCI 440.  PREREQUISITE(S): CSC 403"
14273,SE,441,CONTINUOUS DELIVERY AND DEVOPS,"A study of the tools, techniques, and processes used in continuous delivery and DevOps. Students will learn to transform an organization that uses traditional software release methods into one that embraces continuous delivery and deployment. Topics will include: the economics of DevOps and continuous delivery; the role of virtualization, cloud technologies, and containers; automated builds and testing; value stream maps; the essentials of configuration management; effective use of source code control branches and feature flags to manage multiple lines of development; organizational factors affecting the success of continuous delivery and DevOps adoption including: culture, team organization, collaboration, and software development practices. PREREQUISITE(S): CSC 403"
10825,IS,444,IT AUDITING,"Management and boards continue to recognize the importance of effectively managing information technology (IT) assets - to meet business objectives and to thoughtfully manage IT related business risks.  This course examines the key principles related to auditing information technology processes and related controls and is designed to meet the ever increasing needs of IT audit and IT governance professionals.  In addition, this course aids in the preparation for the Certified Information Systems Auditor (CISA) exam.  PREREQUISITE(S): None"
6492,HCI,445,INQUIRY METHODS AND USE ANALYSIS,"This course provides students with the skills necessary to acquire and organize user information for the purpose of developing task and systems analyses.   Topics covered include survey construction and administration, structured observation, interviewing, and participatory design.  Students learn to evaluate and organize user information toward making analysis and design decisions.  Human communication and presentation skills are developed.  PREREQUISITE(S): IT 403 and (HCI 440 or HCI 441)"
1967,CS,447,CURRICULUM DESIGN FOR THE MIDDLE GRADES,"This course is designed to provide students with a comprehensive understanding of the history of and rationale for middle level education as well as the curricular and pedagogical knowledge needed to meaningfully engage middle level students in learning within and across the content areas. Important considerations and strategies for disciplinary and interdisciplinary learning in the middle school classroom, as well as the importance of reading and writing across the curriculum with regard to these, will be addressed."
6417,SE,450,OBJECT-ORIENTED SOFTWARE DEVELOPMENT,"Principle, techniques and tools of object-oriented modeling, design, implementation, and testing of large-scale software systems.  Topics include design patterns, application frameworks, architectural design, and the applications in the software development process to improve the extensibility, maintainability, and reliability of software systems.  PREREQUISITE(S): CSC 403"
6499,HCI,450,FOUNDATIONS OF HUMAN-COMPUTER INTERACTION,"Application of engineering and psychological theory to the design of computer systems. Overview of applicable research methods and research on perception, cognition, errors, and screen design. Attention will be given to creating and applying guidelines derived from research. PREREQUISITE(S): IT 403"
6630,IS,450,ENTERPRISE SYSTEM IMPLEMENTATION,"Formerly IS 450.  This course is targeted towards information systems professionals who are involved in the planning and implementation of large scale, cross-functional enterprise systems.  Students will examine the characteristics of technology efforts that change and transform the way people perform their tasks and how the new technology structures the flows of information and decision making using workflow modeling methods.   Through case studies and exercises students gain insights into the elements of successful implementations leading to the preparation of a change management plan.  Emphasis is placed on developing mechanisms for communicating and training all affected agents.  PREREQUISITE(S):  IS 430 or PM 430 or completion of five or more other SoC MS level courses should contact the course instructor or an advisor."
13741,IS,452,BIG DATA & THE INTERNET OF THINGS (IoT),"This course surveys system design concepts, techniques, and algorithms in Machine to Machine (M2M), Internet of Things (IoT), and Internet of Everything (IoE). Topics covered include system architecture for big data, sensors and embedded technologies, IoT architecture, consumer vs. industrial IoT, wearable and mobile systems, tracking systems, IoT and big data analytics, market dynamics and entrepreneurial opportunities. Special emphasis is placed on identifying best practices in using big data and IoT through case studies and hands-on exercises.  PREREQUISITE(S): None"
6591,SE,452,OBJECT-ORIENTED ENTERPRISE COMPUTING,"This course focuses on applying object-oriented techniques in the design, development, and integration of server-side enterprise  applications using technologies such as servlets, Java Server Pages,  and JDBC. Topics include web applications, multi-tier architecture,  model-view-controller architecture, database connectivity, and  security. PREREQUISITE(S): CSC 403"
9599,SE,453,ARCHITECTURE AND FRAMEWORKS FOR DEVELOPING CLIENT APPLICATIONS,"This course will focus on software architectures, frameworks, and techniques for developing web-based thin client applications as well as rich desktop client applications. Topics will include discussion on design and architectural patterns, such as model-view-controller pattern; survey of widely used development frameworks for building client applications, such as Struts, Java Server Face (JSF), Swing, and SWT, etc.; discussion of widely used techniques such as AJAX;   evaluation of the strengths and weaknesses of these technologies for making technology decisions. Students will gain hands-on experiences in developing applications that utilizes these frameworks and techniques.   Prerequisite: SE 452."
8711,HCI,454,INTERACTION DESIGN AND INFORMATION ARCHITECTURE,"Information architecture and interactive page design. Perception and use of menus, labels and user controls. Structuring information for navigation and presentation. Selecting and placing user controls for optimizing task flow on pages and across pages. Creating wire frames and using content managers. PREREQUISITE(S): HCI 406 and (HCI 440 or HCI 441)"
10849,IS,455,ELECTRONIC BUSINESS,"An introduction to electronic business. The topics include business models, technologies, business and social impact of e-business.  It explores the tools, skills, business and social implications of emerging electronic business.  In addition to acquiring basic skills for identifying electronic business opportunities and creating a presence in the online marketplace, the student reexamines fundamental processes of business as they are performed in cyberspace in contrast to the marketplace.  This helps them understand changes as the cyberspace grows increasingly important in the global economy. PREREQUISITE(S): None.  For Kellstadt students or students pursuing the MS in Business Information Technology only."
6443,ECT,455,E-COMMERCE WEB SITE ENGINEERING,"(Formerly ECT 555, cross-listed with HCI 513) An introduction to Web site engineering methods and processes to support e-commerce development.  Web site engineering life cycle and user-centered design, including site goals,  business models, value propositions, user analysis, information architecture, interface and navigation design, usability guidelines, database, testing, hosting strategies, usage metrics, and collaborative development.  Technologies for e-commerce, shopping cart, digital payments, promotion strategies, and security issues.  Students will build fully functional Web sites using database and client- and server-side technologies.  PREREQUISITE(S): CSC 401 or IT 411 or HCI 430"
8968,SE,456,ARCHITECTURE OF REAL-TIME SYSTEMS,"This course discusses the principles, styles, and patterns of real-time software architecture. Trade-offs and ramifications of software architecture with respect to performance, maintainability, and reusability, will be explored. The course will also investigate the design and implementation of real-time behavior and constraints for Common Design Patterns such as Observer, Visitor, and Strategy. Finally, the course will demonstrate how creation of real-time Data Driven environment allows the run-time object data to control the behavior and flow of an application. These topics will be discussed in the context of best practices in software engineering such as iterative development, testing, and continuous integration.   PREREQUISITE(S): CSC 403"
8320,IS,456,SYSTEMS THINKING PERSPECTIVE FOR UNDERSTANDING BUSINESS DYNAMICS,This course introduces students to systems thinking and system dynamics modeling for the analysis of business strategy and decision making. Students will learn how to use systems thinking and modeling to visualize and analyze organizations and institutions in terms of the structures and policies that create dynamics and regulate performance. The course will draw on system dynamics modeling and simulation concepts and tools as well as real-world case studies to explain the management of business dynamics. PREREQUISITE(S): IS 421
9600,SE,457,SERVICE-ORIENTED ARCHITECTURE,"An in-depth study of service oriented architecture (SOA) from the business, architectural, and technology perspectives. The business perspective will explain the imperatives behind SOA and discuss the significance of SOA in industry. The architectural perspective will discuss the different architectural models of software development and contrast these with SOA. The technology perspective will provide students with the opportunity to gain the required hands-on experience to analyze, design, implement and deploy SOA solutions that will meet both functional and non-functional requirements. Major topics include software architectures in practice, SOA development lifecycle, Enterprise Service Bus, SOA analysis and design methods, Web Services, and governance. Prerequisite: SE 450 or CSC 435"
11115,SE,459,AGILE SOFTWARE DEVELOPMENT,"This course focuses on the fundamentals, principles, tools, and techniques in agile software development.  Students will gain hands-on experiences in agile software development through projects dealing with various aspects of agile development, including planning, construction, testing, and integration. Students will be able to effectively participate in and manage agile software development as a result of their successfully completing this course.  PREREQUISITE(S): SE 450"
6500,HCI,460,USABILITY EVALUATION METHODS,"Survey of evaluation methods that can be applied to user interfaces. Methods include expert inspections, walkthroughs, usability testing and analytical approaches. Students evaluate existing systems by applying some of these methods. PREREQUISITE(S): IT 403 and (HCI 440 or HCI 441)"
1975,CS,460,LEARNING IN A TECHNOLOGY-SUPPORTED  CLASSROOM,An examination of current theories about instructional technology and of recent literature in the field.  Students will become familiar with particular technology appropriate for their areas of interest and will learn to evaluate this technology for a variety of instructional purposes.  The course includes: frameworks for classifying educational uses of the technology; an analysis of selected research on educational technology; theories and practices of using technology in classrooms; and the advantages and disadvantages of distance learning.  Emphasis throughout will be on why and how technology can be used to enhance the learning process.
8803,CS,461,LITERACY PROCESSES AND PRACTICES,"Foundational theoretical perspectives and practices for teaching and learning language and literacy in a diverse, changing, and political world. Background of knowledge in the area of learning and exposure to the controversies that surround the teaching of literacy will be used to develop an understanding of literacy learning in action. Students will be invited to participate in the current conversations around literacy learning and teaching in order to inform their everyday curricular decisions."
